{"$schema":"https://json-schema.org/draft/2020-12/schema","title":"YVL typography","type":"object","required":["version","font","weight","size","lineHeight"],"additionalProperties":false,"properties":{"version":{"const":"1.0.0"},"font":{"type":"object","required":["display","body","mono"],"propertyValue":{"type":"string"}},"weight":{"type":"object","required":["regular","medium","semibold","bold"],"propertyValue":{"type":"number"}},"size":{"type":"object","required":["xs","sm","md","lg","xl","2xl","3xl"],"propertyValue":{"type":"string"}},"lineHeight":{"type":"object","required":["tight","normal","relaxed"],"propertyValue":{"type":"number"}}}}
