{"version":"1.0.0","font":{"display":"Sora, system-ui, sans-serif","body":"Inter, system-ui, sans-serif","mono":"ui-monospace, SFMono-Regular, monospace"},"weight":{"regular":400,"medium":500,"semibold":600,"bold":700},"size":{"xs":"0.75rem","sm":"0.875rem","md":"1rem","lg":"1.25rem","xl":"1.5rem","2xl":"2rem","3xl":"3rem"},"lineHeight":{"tight":1.15,"normal":1.5,"relaxed":1.65}}
